{
  "$schema": "urn:voidtrace:schema:scenario-patch:0.1.0",
  "kind": "voidtrace.scenario-patch",
  "schemaVersion": "0.1.0",
  "id": "scenario-patch.golden-breakpoint-right-critical-tier-0",
  "revision": 0,
  "gameBuild": "synthetic-fixture-0",
  "baseScenarioRef": {
    "kind": "voidtrace.scenario",
    "schemaVersion": "0.3.0",
    "id": "scenario.golden-breakpoint-right",
    "revision": 0,
    "contentHash": "sha256:20a2fda5b4925fd52cdcc54a799830984fc8a8966cb0d54ccb0519238fefbb67",
    "gameBuild": "synthetic-fixture-0"
  },
  "resultScenario": {
    "id": "scenario.golden-breakpoint-right-critical-tier-0",
    "revision": 0
  },
  "operations": [
    {
      "op": "replace",
      "path": "/actionPlan/0/parameters/criticalTier",
      "value": 0
    }
  ],
  "contentHash": "sha256:7564f7511bf3f1acd033f758b3edd6a4b04223a0aefbaba90f0ceb938fb3232d"
}
