{
  "$schema": "urn:voidtrace:schema:scenario-patch:0.1.0",
  "kind": "voidtrace.scenario-patch",
  "schemaVersion": "0.1.0",
  "id": "scenario-patch.golden-critical-tier-2",
  "revision": 0,
  "gameBuild": "synthetic-fixture-0",
  "baseScenarioRef": {
    "kind": "voidtrace.scenario",
    "schemaVersion": "0.3.0",
    "id": "scenario.golden-direct-critical-armor",
    "revision": 2,
    "contentHash": "sha256:77214ec7c647cc6964075fe439693b5b9048f560aef3e65cb2a486de93cd5bfb",
    "gameBuild": "synthetic-fixture-0"
  },
  "resultScenario": {
    "id": "scenario.golden-patched-critical-tier-2",
    "revision": 0
  },
  "operations": [
    {
      "op": "replace",
      "path": "/actionPlan/0/parameters/criticalTier",
      "value": 2
    }
  ],
  "contentHash": "sha256:e37fcbd363744825ef6e11f122780e3775c2e3b1af6e7e6125e0e0106e81c3f3"
}
